{
  "record_id": "KYT-20260118-A",
  "schema_version": "1.3",
  "generated_at": "2026-03-09T08:29:18.035Z",
  "site": {
    "name_zh": "桂離宮",
    "name_local": "かつらりきゅう",
    "name_en": "Katsura Imperial Villa",
    "city": "Kyoto",
    "region": "KYT",
    "country": "JP",
    "site_type": "zen_temple_garden"
  },
  "observation": {
    "date": "2026-01-18",
    "time_of_day": "afternoon",
    "season": "winter",
    "weather": "晴",
    "crowd_density": "very_low",
    "visit_mode": "guided_tour",
    "companion": "Solo",
    "observer_flags": {
      "sensory_saturation_effect": false,
      "preloaded_knowledge_active": false,
      "ai_collaboration_during_visit": true,
      "repeat_visit": false
    }
  },
  "vs_vector": {
    "Vt": 9,
    "Vl": 8.5,
    "Vr": 6,
    "Vg": 9,
    "Ve": 5.5
  },
  "vs_subtypes": {
    "Vt_subtype": "architectural_heritage",
    "Vl_source": "natural_diffused",
    "Vr_source": "architectural_design",
    "Vg_subtype": "open_framed",
    "Ve_trigger": "self_time_projection"
  },
  "sdindex_computation": {
    "raw_sum": 38,
    "max_possible": 50,
    "sdindex_score": 7.6,
    "formula": "sum(Vt+Vl+Vr+Vg+Ve) / 50 * 10"
  },
  "sensory_resilience": {
    "level": "exceptional",
    "note": "observer assessment of space resistance to crowding/noise, independent of current crowd_density"
  },
  "field_notes": {
    "Vt": "跟傳統京都市中心的寺廟與京都御所的文化不一樣，位於郊區的桂離宮隨著交通工具慢慢運送人們至此，就以讓文化密度有些降低。但是，皇族、茶道文化、江戶曆史的更迭、桂離宮主人的故事，讓這個地方又再度以高文化密度給擁抱。",
    "Vl": "拜訪之際是晴天，而整個場域是宮主精心設計的一個美學場域，推測有完美主義的宮主，將光影、將光線分布，設計到一個近乎無法容忍瑕疵的境界。",
    "Vr": "這裡的空間設計有極度克制敢，設計庭園的人似乎想要觀賞的人知道：我就是要你們覺得這每個空間設計都是完美的。加上有解說員，以及嚴格導覽制度，人流非常低，所以這裡律動是偏慢的。偏慢但又無法隨意停留下來觀賞如此工整的設計，這種律動模式其實無法拿高分，",
    "Vg": "無庸置疑，這個項目是絕對的高分",
    "Ve": "就單純審美觀來看這裡的空間幾何結構絕對拿到高分，但是，這是一個經由導覽才得以觀賞的美，所以不會自然地接受這個幾何之美、在加入人為思考之後，這種過度設計，過度管理會有一種「被控制」的不悅感，沈浸感不會太強烈，因此將分數拉低。"
  },
  "emotion_trajectory": {
    "entry_state": "在此之前我對這個地方了解不深，今天也沒帶耳機聽翻譯，但走著看著，就覺得建造這個很日本美的地方、但住在這裡的人應該很無聊吧！？",
    "turning_point": "求證Google 的AI模式，果不其然，這就是一個精緻孤獨的美學場所！\n桂離宮那些細碎到近乎強迫症的設計，比如每一塊石頭要怎麼擺、樹要修成什麼形狀，窗戶看出去什麼角度可以賞月，倒影如何呈現，其實都是他在「打發時間」的證明。因為豐臣秀吉不但沒殺他，反而給他一堆錢要他往藝術方面走，這年輕人如果不把精力花在這些瑣事上，他的人生可能就得結束了！",
    "exit_state": "這次走進去，我感覺到的那份無奈，就是 400 年前那位親王生活的主旋律。\nAI回應說，其實這才是最接近歷史真相的感受，但也有可能AI習慣順著我的思緒走",
    "trajectory_type": "expectation_collapse_reframe",
    "key_insight": "極度無聊的人，用他極致的才華跟求生意志，蓋出來一個逃避現實的空間。"
  },
  "counterpoint": {
    "paired_record": null
  },
  "ideal_condition": "楓葉季",
  "research_finding": "AI即時的內容補充有可能改變人類感官",
  "asset_class": "Gold_Sample",
  "usable_for_llm_training": true,
  "ip_status": {
    "author": "Sabrina",
    "created_at": "2026-03-09T08:29:18.035Z",
    "license": "CC-BY-4.0",
    "locked": true
  }
}